{
  "$schema": "https://json-schema.org/draft/2020-12/schema",
  "title": "reflection_prompts pack",
  "type": "object",
  "additionalProperties": false,
  "required": [
    "pack_key",
    "version",
    "pack_schema_version",
    "locale",
    "min_app_version",
    "entries"
  ],
  "properties": {
    "pack_key": {
      "const": "reflection_prompts"
    },
    "version": {
      "type": "integer",
      "minimum": 1
    },
    "pack_schema_version": {
      "type": "integer",
      "minimum": 1
    },
    "locale": {
      "const": "fa"
    },
    "min_app_version": {
      "type": "string",
      "pattern": "^[0-9]+(\\.[0-9]+){0,2}$"
    },
    "entries": {
      "type": "array",
      "minItems": 1,
      "items": {
        "type": "object",
        "additionalProperties": false,
        "required": [
          "key",
          "prompt_key",
          "a_key",
          "b_key"
        ],
        "properties": {
          "key": {
            "type": "string",
            "pattern": "^[a-z0-9_]{1,64}$"
          },
          "prompt_key": {
            "type": "string",
            "pattern": "^[a-z0-9_]+(\\.[a-z0-9_]+)+$"
          },
          "a_key": {
            "type": "string",
            "pattern": "^[a-z0-9_]+(\\.[a-z0-9_]+)+$"
          },
          "b_key": {
            "type": "string",
            "pattern": "^[a-z0-9_]+(\\.[a-z0-9_]+)+$"
          },
          "c_key": {
            "type": "string",
            "pattern": "^[a-z0-9_]+(\\.[a-z0-9_]+)+$"
          },
          "a_icon": {
            "type": "string",
            "pattern": "^[a-z0-9_]+/[a-z0-9_]+$",
            "description": "sticker id under assets/art/emoji/ (folder/name)"
          },
          "b_icon": {
            "type": "string",
            "pattern": "^[a-z0-9_]+/[a-z0-9_]+$",
            "description": "sticker id under assets/art/emoji/ (folder/name)"
          },
          "c_icon": {
            "type": "string",
            "pattern": "^[a-z0-9_]+/[a-z0-9_]+$",
            "description": "sticker id under assets/art/emoji/ (folder/name)"
          }
        }
      }
    }
  }
}
